smartctl 7.1 2019-12-30 r5022 [aarch64-linux-4.19.90-2204.4.0.0146.oe1.aarch64] (local build)
Copyright (C) 2002-19, Bruce Allen, Christian Franke, www.smartmontools.org

=== START OF INFORMATION SECTION ===
Vendor:               TOSHIBA
Product:              AL15SEB120N
Revision:             0807
Compliance:           SPC-4
User Capacity:        1,200,243,695,616 bytes [1.20 TB]
Logical block size:   512 bytes
Rotation Rate:        10500 rpm
Form Factor:          2.5 inches
Logical Unit id:      0x50000399b88921b5
Serial number:        X9Q0A5SBFDWG
Device type:          disk
Transport protocol:   SAS (SPL-3)
Local Time is:        Mon May 27 21:46:47 2024 CST
SMART support is:     Available - device has SMART capability.
SMART support is:     Enabled
Temperature Warning:  Enabled

=== START OF READ SMART DATA SECTION ===
SMART Health Status: OK

Current Drive Temperature:     26 C
Drive Trip Temperature:        65 C

Manufactured in week 43 of year 2019
Specified cycle count over device lifetime:  50000
Accumulated start-stop cycles:  113
Specified load-unload count over device lifetime:  600000
Accumulated load-unload cycles:  113
Elements in grown defect list: 0

Error counter log:
           Errors Corrected by           Total   Correction     Gigabytes    Total
               ECC          rereads/    errors   algorithm      processed    uncorrected
           fast | delayed   rewrites  corrected  invocations   [10^9 bytes]  errors
read:     439355       19         0         0          0    1863356.870           0
write:         0        0         0         0          0      35051.125           0

Non-medium error count:      105

SMART Self-test log
Num  Test              Status                 segment  LifeTime  LBA_first_err [SK ASC ASQ]
     Description                              number   (hours)
# 1  Background long   Completed                   -      10                 - [-   -    -]
# 2  Background short  Completed                   -       7                 - [-   -    -]

Long (extended) Self-test duration: 8024 seconds [133.7 minutes]

smartctl 7.1 2019-12-30 r5022 [aarch64-linux-4.19.90-2204.4.0.0146.oe1.aarch64] (local build)
Copyright (C) 2002-19, Bruce Allen, Christian Franke, www.smartmontools.org

=== START OF INFORMATION SECTION ===
Vendor:               TOSHIBA
Product:              AL15SEB120N
Revision:             0807
Compliance:           SPC-4
User Capacity:        1,200,243,695,616 bytes [1.20 TB]
Logical block size:   512 bytes
Rotation Rate:        10500 rpm
Form Factor:          2.5 inches
Logical Unit id:      0x50000399b88925e5
Serial number:        X9Q0A5TVFDWG
Device type:          disk
Transport protocol:   SAS (SPL-3)
Local Time is:        Mon May 27 21:46:47 2024 CST
SMART support is:     Available - device has SMART capability.
SMART support is:     Enabled
Temperature Warning:  Enabled

=== START OF READ SMART DATA SECTION ===
SMART Health Status: OK

Current Drive Temperature:     26 C
Drive Trip Temperature:        65 C

Manufactured in week 43 of year 2019
Specified cycle count over device lifetime:  50000
Accumulated start-stop cycles:  113
Specified load-unload count over device lifetime:  600000
Accumulated load-unload cycles:  113
Elements in grown defect list: 0

Error counter log:
           Errors Corrected by           Total   Correction     Gigabytes    Total
               ECC          rereads/    errors   algorithm      processed    uncorrected
           fast | delayed   rewrites  corrected  invocations   [10^9 bytes]  errors
read:      60452        4         0         0          0    1629446.520           0
write:         0        0         0         0          0       1860.470           0

Non-medium error count:       89

SMART Self-test log
Num  Test              Status                 segment  LifeTime  LBA_first_err [SK ASC ASQ]
     Description                              number   (hours)
# 1  Background long   Completed                   -       9                 - [-   -    -]
# 2  Background short  Completed                   -       7                 - [-   -    -]

Long (extended) Self-test duration: 8024 seconds [133.7 minutes]

smartctl 7.1 2019-12-30 r5022 [aarch64-linux-4.19.90-2204.4.0.0146.oe1.aarch64] (local build)
Copyright (C) 2002-19, Bruce Allen, Christian Franke, www.smartmontools.org

=== START OF INFORMATION SECTION ===
Vendor:               TOSHIBA
Product:              AL15SEB120N
Revision:             0807
Compliance:           SPC-4
User Capacity:        1,200,243,695,616 bytes [1.20 TB]
Logical block size:   512 bytes
Rotation Rate:        10500 rpm
Form Factor:          2.5 inches
Logical Unit id:      0x50000399b8892369
Serial number:        X9Q0A5SYFDWG
Device type:          disk
Transport protocol:   SAS (SPL-3)
Local Time is:        Mon May 27 21:46:48 2024 CST
SMART support is:     Available - device has SMART capability.
SMART support is:     Enabled
Temperature Warning:  Enabled

=== START OF READ SMART DATA SECTION ===
SMART Health Status: OK

Current Drive Temperature:     26 C
Drive Trip Temperature:        65 C

Manufactured in week 43 of year 2019
Specified cycle count over device lifetime:  50000
Accumulated start-stop cycles:  113
Specified load-unload count over device lifetime:  600000
Accumulated load-unload cycles:  113
Elements in grown defect list: 0

Error counter log:
           Errors Corrected by           Total   Correction     Gigabytes    Total
               ECC          rereads/    errors   algorithm      processed    uncorrected
           fast | delayed   rewrites  corrected  invocations   [10^9 bytes]  errors
read:      36657        2         0         0          0    1628952.804           0
write:         0        0         0         0          0       1739.651           0

Non-medium error count:       97

SMART Self-test log
Num  Test              Status                 segment  LifeTime  LBA_first_err [SK ASC ASQ]
     Description                              number   (hours)
# 1  Background long   Completed                   -       9                 - [-   -    -]
# 2  Background short  Completed                   -       7                 - [-   -    -]

Long (extended) Self-test duration: 8024 seconds [133.7 minutes]

smartctl 7.1 2019-12-30 r5022 [aarch64-linux-4.19.90-2204.4.0.0146.oe1.aarch64] (local build)
Copyright (C) 2002-19, Bruce Allen, Christian Franke, www.smartmontools.org

=== START OF INFORMATION SECTION ===
Vendor:               TOSHIBA
Product:              AL15SEB120N
Revision:             0807
Compliance:           SPC-4
User Capacity:        1,200,243,695,616 bytes [1.20 TB]
Logical block size:   512 bytes
Rotation Rate:        10500 rpm
Form Factor:          2.5 inches
Logical Unit id:      0x50000399b8892a79
Serial number:        X9Q0A5W4FDWG
Device type:          disk
Transport protocol:   SAS (SPL-3)
Local Time is:        Mon May 27 21:46:48 2024 CST
SMART support is:     Available - device has SMART capability.
SMART support is:     Enabled
Temperature Warning:  Enabled

=== START OF READ SMART DATA SECTION ===
SMART Health Status: OK

Current Drive Temperature:     26 C
Drive Trip Temperature:        65 C

Manufactured in week 43 of year 2019
Specified cycle count over device lifetime:  50000
Accumulated start-stop cycles:  113
Specified load-unload count over device lifetime:  600000
Accumulated load-unload cycles:  113
Elements in grown defect list: 0

Error counter log:
           Errors Corrected by           Total   Correction     Gigabytes    Total
               ECC          rereads/    errors   algorithm      processed    uncorrected
           fast | delayed   rewrites  corrected  invocations   [10^9 bytes]  errors
read:      33017        9         0         0          0    1628508.848           0
write:         0        0         0         0          0       1723.995           0

Non-medium error count:       55

SMART Self-test log
Num  Test              Status                 segment  LifeTime  LBA_first_err [SK ASC ASQ]
     Description                              number   (hours)
# 1  Background long   Completed                   -      10                 - [-   -    -]
# 2  Background short  Completed                   -       7                 - [-   -    -]

Long (extended) Self-test duration: 8024 seconds [133.7 minutes]

smartctl 7.1 2019-12-30 r5022 [aarch64-linux-4.19.90-2204.4.0.0146.oe1.aarch64] (local build)
Copyright (C) 2002-19, Bruce Allen, Christian Franke, www.smartmontools.org

User Capacity:        960,197,124,096 bytes [960 GB]
Logical block size:   512 bytes
Physical block size:  4096 bytes
LB provisioning type: not reported [LBPME=1, LBPRZ=1]
Rotation Rate:        Solid State Device
Form Factor:          2.5 inches
Logical Unit id:      0x5002538e19b24150
Serial number:        S47NNA0MB10961
Device type:          disk
Transport protocol:   SAS (SPL-3)
Local Time is:        Mon May 27 21:46:48 2024 CST
SMART support is:     Available - device has SMART capability.
SMART support is:     Enabled
Temperature Warning:  Disabled or Not Supported

=== START OF READ SMART DATA SECTION ===
SMART Health Status: OK

Percentage used endurance indicator: 0%
Current Drive Temperature:     26 C
Drive Trip Temperature:        70 C

Error Counter logging not supported


[GLTSD (Global Logging Target Save Disable) set. Enable Save with '-S on']
No Self-tests have been logged

smartctl 7.1 2019-12-30 r5022 [aarch64-linux-4.19.90-2204.4.0.0146.oe1.aarch64] (local build)
Copyright (C) 2002-19, Bruce Allen, Christian Franke, www.smartmontools.org

=== START OF INFORMATION SECTION ===
Vendor:               TOSHIBA
Product:              AL15SEB120N
Revision:             0807
Compliance:           SPC-4
User Capacity:        1,200,243,695,616 bytes [1.20 TB]
Logical block size:   512 bytes
Rotation Rate:        10500 rpm
Form Factor:          2.5 inches
Logical Unit id:      0x50000399b88921b5
Serial number:        X9Q0A5SBFDWG
Device type:          disk
Transport protocol:   SAS (SPL-3)
Local Time is:        Mon May 27 21:46:49 2024 CST
SMART support is:     Available - device has SMART capability.
SMART support is:     Enabled
Temperature Warning:  Enabled

=== START OF READ SMART DATA SECTION ===
SMART Health Status: OK

Current Drive Temperature:     26 C
Drive Trip Temperature:        65 C

Manufactured in week 43 of year 2019
Specified cycle count over device lifetime:  50000
Accumulated start-stop cycles:  113
Specified load-unload count over device lifetime:  600000
Accumulated load-unload cycles:  113
Elements in grown defect list: 0

Error counter log:
           Errors Corrected by           Total   Correction     Gigabytes    Total
               ECC          rereads/    errors   algorithm      processed    uncorrected
           fast | delayed   rewrites  corrected  invocations   [10^9 bytes]  errors
read:     439355       19         0         0          0    1863356.870           0
write:         0        0         0         0          0      35051.126           0

Non-medium error count:      105

SMART Self-test log
Num  Test              Status                 segment  LifeTime  LBA_first_err [SK ASC ASQ]
     Description                              number   (hours)
# 1  Background long   Completed                   -      10                 - [-   -    -]
# 2  Background short  Completed                   -       7                 - [-   -    -]

Long (extended) Self-test duration: 8024 seconds [133.7 minutes]

smartctl 7.1 2019-12-30 r5022 [aarch64-linux-4.19.90-2204.4.0.0146.oe1.aarch64] (local build)
Copyright (C) 2002-19, Bruce Allen, Christian Franke, www.smartmontools.org

=== START OF INFORMATION SECTION ===
Vendor:               TOSHIBA
Product:              AL15SEB120N
Revision:             0807
Compliance:           SPC-4
User Capacity:        1,200,243,695,616 bytes [1.20 TB]
Logical block size:   512 bytes
Rotation Rate:        10500 rpm
Form Factor:          2.5 inches
Logical Unit id:      0x50000399b88925e5
Serial number:        X9Q0A5TVFDWG
Device type:          disk
Transport protocol:   SAS (SPL-3)
Local Time is:        Mon May 27 21:46:49 2024 CST
SMART support is:     Available - device has SMART capability.
SMART support is:     Enabled
Temperature Warning:  Enabled

=== START OF READ SMART DATA SECTION ===
SMART Health Status: OK

Current Drive Temperature:     26 C
Drive Trip Temperature:        65 C

Manufactured in week 43 of year 2019
Specified cycle count over device lifetime:  50000
Accumulated start-stop cycles:  113
Specified load-unload count over device lifetime:  600000
Accumulated load-unload cycles:  113
Elements in grown defect list: 0

Error counter log:
           Errors Corrected by           Total   Correction     Gigabytes    Total
               ECC          rereads/    errors   algorithm      processed    uncorrected
           fast | delayed   rewrites  corrected  invocations   [10^9 bytes]  errors
read:      60452        4         0         0          0    1629446.520           0
write:         0        0         0         0          0       1860.471           0

Non-medium error count:       89

SMART Self-test log
Num  Test              Status                 segment  LifeTime  LBA_first_err [SK ASC ASQ]
     Description                              number   (hours)
# 1  Background long   Completed                   -       9                 - [-   -    -]
# 2  Background short  Completed                   -       7                 - [-   -    -]

Long (extended) Self-test duration: 8024 seconds [133.7 minutes]

smartctl 7.1 2019-12-30 r5022 [aarch64-linux-4.19.90-2204.4.0.0146.oe1.aarch64] (local build)
Copyright (C) 2002-19, Bruce Allen, Christian Franke, www.smartmontools.org

=== START OF INFORMATION SECTION ===
Vendor:               TOSHIBA
Product:              AL15SEB120N
Revision:             0807
Compliance:           SPC-4
User Capacity:        1,200,243,695,616 bytes [1.20 TB]
Logical block size:   512 bytes
Rotation Rate:        10500 rpm
Form Factor:          2.5 inches
Logical Unit id:      0x50000399b8892369
Serial number:        X9Q0A5SYFDWG
Device type:          disk
Transport protocol:   SAS (SPL-3)
Local Time is:        Mon May 27 21:46:49 2024 CST
SMART support is:     Available - device has SMART capability.
SMART support is:     Enabled
Temperature Warning:  Enabled

=== START OF READ SMART DATA SECTION ===
SMART Health Status: OK

Current Drive Temperature:     26 C
Drive Trip Temperature:        65 C

Manufactured in week 43 of year 2019
Specified cycle count over device lifetime:  50000
Accumulated start-stop cycles:  113
Specified load-unload count over device lifetime:  600000
Accumulated load-unload cycles:  113
Elements in grown defect list: 0

Error counter log:
           Errors Corrected by           Total   Correction     Gigabytes    Total
               ECC          rereads/    errors   algorithm      processed    uncorrected
           fast | delayed   rewrites  corrected  invocations   [10^9 bytes]  errors
read:      36657        2         0         0          0    1628952.805           0
write:         0        0         0         0          0       1739.652           0

Non-medium error count:       97

SMART Self-test log
Num  Test              Status                 segment  LifeTime  LBA_first_err [SK ASC ASQ]
     Description                              number   (hours)
# 1  Background long   Completed                   -       9                 - [-   -    -]
# 2  Background short  Completed                   -       7                 - [-   -    -]

Long (extended) Self-test duration: 8024 seconds [133.7 minutes]

smartctl 7.1 2019-12-30 r5022 [aarch64-linux-4.19.90-2204.4.0.0146.oe1.aarch64] (local build)
Copyright (C) 2002-19, Bruce Allen, Christian Franke, www.smartmontools.org

=== START OF INFORMATION SECTION ===
Vendor:               TOSHIBA
Product:              AL15SEB120N
Revision:             0807
Compliance:           SPC-4
User Capacity:        1,200,243,695,616 bytes [1.20 TB]
Logical block size:   512 bytes
Rotation Rate:        10500 rpm
Form Factor:          2.5 inches
Logical Unit id:      0x50000399b8892a79
Serial number:        X9Q0A5W4FDWG
Device type:          disk
Transport protocol:   SAS (SPL-3)
Local Time is:        Mon May 27 21:46:53 2024 CST
SMART support is:     Available - device has SMART capability.
SMART support is:     Enabled
Temperature Warning:  Enabled

=== START OF READ SMART DATA SECTION ===
SMART Health Status: OK

Current Drive Temperature:     26 C
Drive Trip Temperature:        65 C

Manufactured in week 43 of year 2019
Specified cycle count over device lifetime:  50000
Accumulated start-stop cycles:  113
Specified load-unload count over device lifetime:  600000
Accumulated load-unload cycles:  113
Elements in grown defect list: 0

Error counter log:
           Errors Corrected by           Total   Correction     Gigabytes    Total
               ECC          rereads/    errors   algorithm      processed    uncorrected
           fast | delayed   rewrites  corrected  invocations   [10^9 bytes]  errors
read:      33017        9         0         0          0    1628508.849           0
write:         0        0         0         0          0       1723.997           0

Non-medium error count:       55

SMART Self-test log
Num  Test              Status                 segment  LifeTime  LBA_first_err [SK ASC ASQ]
     Description                              number   (hours)
# 1  Background long   Completed                   -      10                 - [-   -    -]
# 2  Background short  Completed                   -       7                 - [-   -    -]

Long (extended) Self-test duration: 8024 seconds [133.7 minutes]

smartctl 7.1 2019-12-30 r5022 [aarch64-linux-4.19.90-2204.4.0.0146.oe1.aarch64] (local build)
Copyright (C) 2002-19, Bruce Allen, Christian Franke, www.smartmontools.org

=== START OF INFORMATION SECTION ===
Model Family:     Samsung based SSDs
Device Model:     SAMSUNG MZ7KH960HAJR-00005
Serial Number:    S47NNA0MB10961
LU WWN Device Id: 5 002538 e19b24150
Firmware Version: HXM7404Q
User Capacity:    960,197,124,096 bytes [960 GB]
Sector Sizes:     512 bytes logical, 4096 bytes physical
Rotation Rate:    Solid State Device
Form Factor:      2.5 inches
Device is:        In smartctl database [for details use: -P show]
ATA Version is:   ACS-4 T13/BSR INCITS 529 revision 5
SATA Version is:  SATA 3.2, 6.0 Gb/s (current: 6.0 Gb/s)
Local Time is:    Mon May 27 21:46:54 2024 CST
SMART support is: Available - device has SMART capability.
SMART support is: Enabled

=== START OF READ SMART DATA SECTION ===
SMART Status not supported: ATA return descriptor not supported by controller firmware
SMART overall-health self-assessment test result: PASSED
Warning: This result is based on an Attribute check.

General SMART Values:
Offline data collection status:  (0x00)	Offline data collection activity
					was never started.
					Auto Offline Data Collection: Disabled.
Self-test execution status:      (   0)	The previous self-test routine completed
					without error or no self-test has ever 
					been run.
Total time to complete Offline 
data collection: 		(    0) seconds.
Offline data collection
capabilities: 			 (0x53) SMART execute Offline immediate.
					Auto Offline data collection on/off support.
					Suspend Offline collection upon new
					command.
					No Offline surface scan supported.
					Self-test supported.
					No Conveyance Self-test supported.
					Selective Self-test supported.
SMART capabilities:            (0x0003)	Saves SMART data before entering
					power-saving mode.
					Supports SMART auto save timer.
Error logging capability:        (0x01)	Error logging supported.
					General Purpose Logging supported.
Short self-test routine 
recommended polling time: 	 (   2) minutes.
Extended self-test routine
recommended polling time: 	 (  60) minutes.
SCT capabilities: 	       (0x003d)	SCT Status supported.
					SCT Error Recovery Control supported.
					SCT Feature Control supported.
					SCT Data Table supported.

SMART Attributes Data Structure revision number: 1
Vendor Specific SMART Attributes with Thresholds:
ID# ATTRIBUTE_NAME          FLAG     VALUE WORST THRESH TYPE      UPDATED  WHEN_FAILED RAW_VALUE
  5 Reallocated_Sector_Ct   0x0033   100   100   010    Pre-fail  Always       -       0
  9 Power_On_Hours          0x0032   093   093   000    Old_age   Always       -       31401
 12 Power_Cycle_Count       0x0032   099   099   000    Old_age   Always       -       94
177 Wear_Leveling_Count     0x0013   099   099   005    Pre-fail  Always       -       6
179 Used_Rsvd_Blk_Cnt_Tot   0x0013   100   100   010    Pre-fail  Always       -       0
180 Unused_Rsvd_Blk_Cnt_Tot 0x0013   100   100   010    Pre-fail  Always       -       4248
181 Program_Fail_Cnt_Total  0x0032   100   100   010    Old_age   Always       -       0
182 Erase_Fail_Count_Total  0x0032   100   100   010    Old_age   Always       -       0
183 Runtime_Bad_Block       0x0013   100   100   010    Pre-fail  Always       -       0
184 End-to-End_Error        0x0033   100   100   097    Pre-fail  Always       -       0
187 Uncorrectable_Error_Cnt 0x0032   100   100   000    Old_age   Always       -       0
190 Airflow_Temperature_Cel 0x0032   074   043   000    Old_age   Always       -       26
194 Temperature_Celsius     0x0022   074   042   000    Old_age   Always       -       26 (Min/Max 21/58)
195 ECC_Error_Rate          0x001a   200   200   000    Old_age   Always       -       0
197 Current_Pending_Sector  0x0032   100   100   000    Old_age   Always       -       0
199 CRC_Error_Count         0x003e   100   100   000    Old_age   Always       -       0
202 Exception_Mode_Status   0x0033   100   100   010    Pre-fail  Always       -       0
235 POR_Recovery_Count      0x0012   099   099   000    Old_age   Always       -       76
241 Total_LBAs_Written      0x0032   099   099   000    Old_age   Always       -       5316390408
242 Total_LBAs_Read         0x0032   099   099   000    Old_age   Always       -       2103359576
243 SATA_Downshift_Ct       0x0032   100   100   000    Old_age   Always       -       0
244 Thermal_Throttle_St     0x0032   100   100   000    Old_age   Always       -       0
245 Timed_Workld_Media_Wear 0x0032   100   100   000    Old_age   Always       -       65535
246 Timed_Workld_RdWr_Ratio 0x0032   100   100   000    Old_age   Always       -       65535
247 Timed_Workld_Timer      0x0032   100   100   000    Old_age   Always       -       65535
251 NAND_Writes             0x0032   100   100   000    Old_age   Always       -       5371601408

SMART Error Log Version: 1
No Errors Logged

SMART Self-test log structure revision number 1
No self-tests have been logged.  [To run self-tests, use: smartctl -t]

SMART Selective self-test log data structure revision number 1
 SPAN  MIN_LBA  MAX_LBA  CURRENT_TEST_STATUS
    1        0        0  Not_testing
    2        0        0  Not_testing
    3        0        0  Not_testing
    4        0        0  Not_testing
    5        0        0  Not_testing
Selective self-test flags (0x0):
  After scanning selected spans, do NOT read-scan remainder of disk.
If Selective self-test is pending on power-up, resume after 0 minute delay.

